{
  "evidence_comment_url": "https://github.com/amirbena/code-review-skill/issues/486#issuecomment-6158695359",
  "issue_links": [
    {
      "action": "kept-open",
      "fingerprint": "95204433e8ae9042cc91906618576f519611ec4999789d2168c5c39dcb41509e",
      "issue": 650
    }
  ],
  "published_at": "2026-10-14T01:16:42Z",
  "publisher_identity": "benchmark-publication[bot]",
  "publisher_run_url": "https://github.com/amirbena/code-review-skill/actions/runs/38494816589",
  "record_commit": "8b8a0aa94add8dbb44e953659870b8a8465e803f",
  "record_permalink": "https://github.com/amirbena/code-review-skill/blob/8b8a0aa94add8dbb44e953659870b8a8465e803f/records/sentinel/2026/sentinel-20261013T220428Z-4e5f9827228b.json",
  "record_sha256": "b1a31a87251a698f5dbc7e25299e4e35ace3b04002318610a3b3ecb2f702882b",
  "run_id": "sentinel-20261013T220428Z-4e5f9827228b",
  "schema": "benchmark-receipt/v1",
  "steps_done": [
    "validate",
    "persist",
    "reconcile",
    "announce",
    "receipt"
  ]
}
